{
  "schema_version": "1.0",
  "dataset_id": "reporting.metric_series.monthly_income_expense.v1",
  "columns": [
    {
      "name": "reporting_period",
      "data_type": "date",
      "nullable": false,
      "semantic_role": "time",
      "unit": null
    },
    {
      "name": "income",
      "data_type": "number",
      "nullable": false,
      "semantic_role": "metric",
      "unit": "USD"
    },
    {
      "name": "expense",
      "data_type": "number",
      "nullable": false,
      "semantic_role": "metric",
      "unit": "USD"
    }
  ],
  "rows": [
    {
      "reporting_period": "2026-01-01",
      "income": 125000.0,
      "expense": 101000.0
    },
    {
      "reporting_period": "2026-02-01",
      "income": 131500.0,
      "expense": 104250.0
    },
    {
      "reporting_period": "2026-03-01",
      "income": 128900.0,
      "expense": 109400.0
    },
    {
      "reporting_period": "2026-04-01",
      "income": 136200.0,
      "expense": 111300.0
    },
    {
      "reporting_period": "2026-05-01",
      "income": 140750.0,
      "expense": 115050.0
    },
    {
      "reporting_period": "2026-06-01",
      "income": 143100.0,
      "expense": 117900.0
    }
  ],
  "row_count": 6,
  "total_row_count": 6,
  "truncated": false,
  "source": "reporting_fixture",
  "query_summary": "Monthly income and expense totals for the last 6 months.",
  "time_range": {
    "start": "2026-01-01",
    "end": "2026-06-30"
  },
  "warnings": [],
  "provenance": {
    "provider": "fixture",
    "tool_name": "reporting.query_metric_series",
    "aggregation": "sum",
    "granularity": "month"
  }
}
